[
  {
    "schema_version": "1.0",
    "app_id": 1,
    "app": "Salesforce",
    "category": "CRM and Sales",
    "website_hint": "http://salesforce.com/",
    "description": "Cloud CRM and business platform with sales, service, marketing, commerce, and data products.",
    "auth_status": "CONFIRMED",
    "auth_methods": [
      "OAuth 2.0",
      "Bearer/token"
    ],
    "self_serve_status": "SELF_SERVE_WITH_RESTRICTIONS",
    "self_serve_details": "A free Developer Edition org is documented for testing/development. API use requires the API Enabled permission and an OAuth client app configured within the org; this does not establish free production API access for every customer plan.",
    "credential_access": {
      "status": "RESTRICTED",
      "path": "Create/use a Salesforce org, enable API permission for the user, and configure an external client app/OAuth flow in that org.",
      "plan_or_gate": "Free Developer Edition is available for test/development; production org edition, user permissions, and org setup still govern access."
    },
    "api": {
      "available": "YES",
      "types": [
        "REST"
      ],
      "breadth": "BROAD",
      "details": "Official REST API supports create/manipulate/search of Salesforce records and access to query results, metadata, and other resources; Bulk, Metadata, and Connect REST APIs cover additional jobs. No endpoint count estimated."
    },
    "mcp": {
      "status": "AVAILABLE",
      "details": "First-party Salesforce DX MCP Server (beta) and Salesforce Hosted MCP Servers are listed in Salesforce developer documentation. These connect agents to an org/platform; this is distinct from a generic MCP wrapper.",
      "search_scope": "Official Salesforce developer MCP-solutions page and linked first-party server references inspected."
    },
    "buildability": {
      "verdict": "BUILDABLE_WITH_CONSTRAINTS",
      "blocker": "Org-scoped OAuth/client-app setup and API permission; production access depends on the target org and plan.",
      "rationale": "A documented REST API, OAuth flow, free test/developer org path, and official MCP options make an integration technically feasible. Org-specific credentials/permissions and production edition access prevent treating it as universally frictionless."
    },
    "evidence": [
      {
        "claim": "Salesforce positions the product as a CRM suite with Sales Cloud, Service Cloud, Marketing Cloud and Commerce Cloud.",
        "field": "description",
        "source_url": "https://www.salesforce.com/crm/",
        "source_title": "Salesforce CRM",
        "source_type": "official_product",
        "accessed_at": "2026-09-24",
        "support": "supports",
        "excerpt_or_observation": "Official CRM page lists Sales Cloud, Service Cloud, Marketing Cloud and Commerce Cloud products."
      },
      {
        "claim": "Salesforce Connect REST quick start instructs developers to create an external client app, enable OAuth and connect with OAuth to obtain an access token.",
        "field": "auth",
        "source_url": "https://developer.salesforce.com/docs/platform/connect-rest-api/guide/quickstart",
        "source_title": "Connect REST API Quick Start",
        "source_type": "official_auth_docs",
        "accessed_at": "2026-09-24",
        "support": "supports",
        "excerpt_or_observation": "Page outlines OAuth setup and obtaining/passing an access token."
      },
      {
        "claim": "REST API requests operate with access tokens; REST API is an HTTP interface for records, queries and metadata.",
        "field": "auth",
        "source_url": "https://developer.salesforce.com/docs/platform/api-rest/guide/intro-what-is-rest-api.html",
        "source_title": "About REST API",
        "source_type": "official_api_docs",
        "accessed_at": "2026-09-24",
        "support": "supports",
        "excerpt_or_observation": "REST API docs describe Salesforce access through HTTP requests to resources; quick-start documents OAuth token flow."
      },
      {
        "claim": "Developer Edition is free for testing/development; user profile needs API Enabled permission.",
        "field": "self_serve",
        "source_url": "https://developer.salesforce.com/docs/platform/connect-rest-api/guide/quickstart_dev_org.html",
        "source_title": "Step One: Sign up for Salesforce Developer Edition",
        "source_type": "official_docs",
        "accessed_at": "2026-09-24",
        "support": "supports",
        "excerpt_or_observation": "The page calls Developer Edition a free testing/development solution and notes the API Enabled user permission."
      },
      {
        "claim": "API access requires an org/user permission and an org-configured client app, so a free test org is not proof of free production access.",
        "field": "credential_access",
        "source_url": "https://developer.salesforce.com/docs/platform/connect-rest-api/guide/quickstart_dev_org.html",
        "source_title": "Step One: Sign up for Salesforce Developer Edition",
        "source_type": "official_docs",
        "accessed_at": "2026-09-24",
        "support": "supports",
        "excerpt_or_observation": "Developer Edition instructions require API Enabled permission; authorization setup is configured in a Salesforce org."
      },
      {
        "claim": "Salesforce REST API supports data create/manipulation/search and access to records, query results and metadata; additional APIs support other functions.",
        "field": "api",
        "source_url": "https://developer.salesforce.com/docs/platform/api-rest/guide/intro-what-is-rest-api.html",
        "source_title": "About REST API",
        "source_type": "official_api_docs",
        "accessed_at": "2026-09-24",
        "support": "supports",
        "excerpt_or_observation": "The official overview describes REST resources, records, query results, metadata, and related Bulk/Metadata/Connect APIs."
      },
      {
        "claim": "Salesforce officially lists Salesforce DX MCP Server and Hosted MCP Servers.",
        "field": "mcp",
        "source_url": "https://developer.salesforce.com/docs/ai/agentforce/guide/mcp.html",
        "source_title": "MCP Solutions for Developers",
        "source_type": "official_docs",
        "accessed_at": "2026-09-24",
        "support": "supports",
        "excerpt_or_observation": "First-party Salesforce MCP solutions table includes Salesforce DX MCP Server (beta) and Salesforce Hosted MCP Servers."
      },
      {
        "claim": "OAuth/API setup and org permissions are material build constraints despite a documented test org and first-party MCP offerings.",
        "field": "buildability",
        "source_url": "https://developer.salesforce.com/docs/platform/connect-rest-api/guide/quickstart_dev_org.html",
        "source_title": "Step One: Sign up for Salesforce Developer Edition",
        "source_type": "official_docs",
        "accessed_at": "2026-09-24",
        "support": "supports",
        "excerpt_or_observation": "Free Developer Edition is for testing/development and requires API Enabled permission; combine with org-scoped OAuth setup."
      }
    ],
    "confidence": "HIGH",
    "research_timestamp": "2026-09-24T15:12:08Z",
    "research_status": "COMPLETE",
    "verification_status": "NOT_CHECKED",
    "source_conflicts": [],
    "limitations": [
      "A direct Salesforce OAuth deep-link tried during source discovery returned 404; the current Quick Start and REST API guide were used instead.",
      "This is a public-documentation assessment; no Salesforce org was created or tested."
    ],
    "researcher_notes": "Pilot sample selected to test OAuth, free developer org vs customer-org access, and first-party MCP discovery."
  },
  {
    "schema_version": "1.0",
    "app_id": 22,
    "app": "Twilio",
    "category": "Communications and Messaging",
    "website_hint": "http://twilio.com/",
    "description": "Cloud communications platform with APIs for messaging, voice, and email.",
    "auth_status": "CONFIRMED",
    "auth_methods": [
      "API key",
      "Basic"
    ],
    "self_serve_status": "SELF_SERVE_WITH_RESTRICTIONS",
    "self_serve_details": "Twilio documents free-trial signup without a credit card after email and phone verification. Trial includes limited product units, a 30-day expiry, and account-status restrictions; paid upgrade is needed to remove trial limits.",
    "credential_access": {
      "status": "RESTRICTED",
      "path": "Create a Twilio account, verify email and phone, then view Account SID/Auth Token in Console or create API keys.",
      "plan_or_gate": "Free trial credentials are available; trial usage and recipient/geographic/content restrictions apply, with paid upgrade to remove restrictions."
    },
    "api": {
      "available": "YES",
      "types": [
        "REST",
        "SDK",
        "Webhooks",
        "CLI"
      ],
      "breadth": "BROAD",
      "details": "Multi-product HTTP APIs and SDK/CLI support; official Twilio documentation describes a hosted docs MCP indexing public API specifications across products. API breadth is broad across communications products; no endpoint count is used in this record."
    },
    "mcp": {
      "status": "AVAILABLE",
      "details": "First-party hosted Twilio MCP at https://mcp.twilio.com/docs. It searches/retrieves API docs and schemas (read-only); it does not execute Twilio API operations and needs no Twilio credentials.",
      "search_scope": "Official Twilio AI/MCP documentation inspected, including features, indexed material, auth and limitations."
    },
    "buildability": {
      "verdict": "BUILDABLE_WITH_CONSTRAINTS",
      "blocker": "Trial unit, recipient, geographic, template, and expiry restrictions; production sending requires paid account/upgrade.",